תמונה,פתרון,רמז קל,רמז קשה
images/000220.jpg,פגישת עסקים,מפגש מקצועי,שיחה מסחרית בין אנשי עסקים
images/000221.jpg,משפט שדה,שיפוט מהיר וללא הליך הוגן,צדק מאולתר ללא בית משפט
images/000222.jpg,חניה באדום לבן,עצירת רכב במקום אסור,להשאיר את הרכב איפה שאסור בהחלט
images/000223.jpg,שיגור רקטה,שליחת טיל לחלל,הזנקת כלי טיס לשמיים
images/000224.jpg,בקבוק בלי פקק,מיכל משקה פתוח,כלי קיבול נוזלים ללא אטם
images/000225.jpg,נסיעה דחופה,הובלה במהירות,טיול בלוח זמנים צפוף
images/000226.jpg,ספירלה,צורה מסתלסלת,קו מתפתל שמתכנס פנימה
images/000227.jpg,מוסר כליות,רגשות אשמה,תחושת חרטה עמוקה
images/000228.jpg,משחקי היורו,תחרות כדורגל אירופאית,אליפות הכדורגל של היבשת הישנה
images/000229.jpg,פיסטוק חלבי,אגוז ירקרק,פרי קטן ומלוח בקליפה קשה
images/000230.jpg,דלעת ערמונים,מרק סתווי,תבשיל כתום עם טעם אגוזי
images/000231.jpg,ארטיק בננה,קרטיב בטעם פרי טרופי,ממתק קפוא על מקל בטעם קוף
images/000232.jpg,זהבה,שם פרטי נשי,בחורה ששמה כשם מתכת יקרה
images/000233.jpg,בא בצל קורתו,התארח בביתו של מישהו,נכנס תחת הגג של אחר
images/000234.jpg,פרא אדם,אדם לא מתורבת,יצור אנושי שגדל ללא חברה
images/000235.jpg,מסדר כנפיים,טקס צבאי לטייסים,טקס הענקת תג לחיל האוויר
images/000236.jpg,שירות לקוחות,עזרה ללקוחות,מחלקה שעונה לפניות הציבור
images/000237.jpg,חום כבד,טמפרטורה גבוהה מאוד,מזג אוויר שמרגיש כמו תנור
images/000238.jpg,סחיטה באיומים,דרישת כסף בכוח,לקיחת משהו בכפייה תוך שימוש בפחד
images/000239.jpg,תא קולי,מערכת להשארת הודעות,מענה אוטומטי לטלפון
images/000240.jpg,פסדובלה,סוג של ריקוד,צעדים ספרדיים בקצב של שניים
images/000241.jpg,בור ועם הארץ,אדם חסר השכלה,ביטוי למי שאין לו ידע בסיסי
images/000242.jpg,קוטל כינים,תרופה נגד טפילי שיער,שמפו שמחסל את האורחים הלא רצויים בראש
images/000243.jpg,שנת ישרים,שינה עמוקה ורגועה,מנוחה של אנשים טובים
images/000244.jpg,כדור נגד כאב ראש,תרופה לכאבים,גלולה שמפסיקה את הלמות הרקות
images/000245.jpg,מסיר את הכובע,מחווה של כבוד,ביטוי להערכה עמוקה
images/000246.jpg,על חבל דק,במצב מסוכן או עדין,הליכה בין הטיפות בלי ליפול
images/000247.jpg,אצבע בעין,פגיעה מכוונת,דקירה כואבת באיבר הראייה
images/000248.jpg,עיתון,מקור מידע מודפס,דפים עם חדשות טריות
images/000249.jpg,רעלה,כיסוי פנים מסורתי,בד שמסתיר את הפנים של אישה
images/000250.jpg,תמונה משפחתית,צילום של בני משפחה,פורטרט קבוצתי של קרובי דם
images/000251.jpg,מסביר פנים,מקבל בחביבות,מראה פנים ידידותי
images/000252.jpg,השבת אבדה,החזרת חפץ שנמצא,מצווה של החזרת רכוש לבעליו
images/000253.jpg,הסתרת ראיות,העלמת הוכחות,ניסיון למנוע גילוי של עובדות מפלילות
images/000254.jpg,עבודה בעיניים,רמאות או הונאה,ניסיון להטעות מישהו
images/000255.jpg,בזיליקום,עשב תיבול,צמח ריחני למאכלים איטלקיים
images/000256.jpg,מרגריטה,קוקטייל אלכוהולי,משקה מקסיקני עם טקילה ומיץ ליים
images/000257.jpg,עלה תאנה,כיסוי מינימלי,הסוואה דקה למשהו שרוצים להסתיר
images/000258.jpg,בטן המטוס,חלל אחסון בכלי טיס,מקום המטען בתחתית כלי התעופה
images/000259.jpg,ממליץ בחום,נותן המלצה חיובית מאוד,מעודד מאוד לעשות משהו
images/000260.jpg,מס שפתיים,דיבור ללא כוונה אמיתית,מילים ריקות שנאמרות מתוך חובה
images/000261.jpg,הצדק יצא לאור,האמת התגלתה,ביטוי לגילוי האמת אחרי זמן
images/000262.jpg,שינוי במידת החום,הבדל בטמפרטורה,עלייה או ירידה במספר על המדחום
images/000263.jpg,שורש הבעיה,מקור הקושי,הסיבה העמוקה לבעיה
images/000264.jpg,העלים עין,התעלם במכוון,בחר שלא לראות משהו
images/000265.jpg,חדרן,עובד במלון,מי שמנקה ומסדר חדרים לאורחים
images/000266.jpg,הקוטב הצפוני,נקודה בצפון כדור הארץ,המקום הכי צפוני בעולם
images/000267.jpg,הפיל עליו תיק,האשים מישהו בשקר,ייחס אשמה לא מוצדקת
images/000268.jpg,מגשים חלומות,מממש שאיפות,הופך פנטזיות למציאות
images/000269.jpg,ספר מחזור,אלבום זיכרונות מבית הספר,קובץ תמונות וזיכרונות מימי הלימודים
images/000270.jpg,דואר זבל,הודעות לא רצויות,מכתבים אלקטרוניים שנשלחים בכמויות
images/000271.jpg,תיק אוכל,כלי לנשיאת מזון,תיקית צהריים לבית הספר או לעבודה
images/000272.jpg,עיירה פסטורלית,יישוב כפרי שליו,מקום מגורים קטן עם אווירה רגועה
images/000273.jpg,תא דם,יחידה בסיסית בדם,חלקיק זעיר שזורם בעורקים
images/000274.jpg,תולעת משי,זחל שמייצר בד יקר,יצור קטן שיוצר חוטים עדינים
images/000275.jpg,פיצה איטלקית,מאכל איטלקי פופולרי,מאפה עגול עם גבינה ורוטב עגבניות
images/000276.jpg,סרט שחור לבן,סרט ללא צבע,קולנוע בשני גוונים בלבד
images/000277.jpg,סוכן חשאי,מרגל,איש מודיעין שפועל בסתר
images/000278.jpg,צו הריסה,הוראה משפטית להרוס מבנה,פקודה רשמית לפרק בניין
images/000279.jpg,איטריות,מאכל על בסיס בצק,פסטה דקה וארוכה
images/000280.jpg,צו מעצר,הוראה משפטית לעצור אדם,מסמך רשמי שמאפשר לקחת מישהו למשמורת
images/000281.jpg,קראק פאי,מאפה פריך,עוגת פירורים טעימה
images/000282.jpg,ערוכה לקרב,מוכנה למלחמה,במצב של כוננות לעימות
images/000283.jpg,לוחם בעזה,חייל בשטח הפלסטיני,חיל רגלים בפעילות ברצועה
images/000284.jpg,מכסה מנוע,חלק מרכב הרכב,הגג המתרומם מעל לב המכונית
images/000285.jpg,צבעי הקשת,ספקטרום של גוונים,שבעה צבעים שמופיעים אחרי הגשם
images/000286.jpg,גזע המוח,חלק במערכת העצבים,מרכז השליטה הבסיסי במוח
images/000287.jpg,הנוער העובד והלומד,תנועת נוער,ארגון חינוכי לצעירים שמשלב עבודה ולימודים
images/000288.jpg,עולם תחתון,חברה עבריינית,קהילה של פושעים ועבריינים
images/000289.jpg,מצעד צבאי,תהלוכה של חיילים,הפגנת כוח של הצבא ברחובות
images/000290.jpg,שיח חרשים,תקשורת ללא הבנה,דו-שיח שבו כל צד מדבר ולא מקשיב
images/000291.jpg,מפתח שוודי,כלי עבודה מתכוונן,מכשיר לאחיזה והידוק של ברגים בגדלים שונים
images/000292.jpg,מעשה כשפים,פעולה מאגית,קסם או לחש שמשנה את המציאות
images/000293.jpg,ניצת הדובדבן,פריחת עץ הדובדבן,פרח לבן או ורוד שמבשר את בוא האביב
images/000294.jpg,מעשה רב,פעולה של אדם חשוב,מעשה שמלמד יותר ממילים
images/000295.jpg,פוליטיקה,ניהול ענייני המדינה,משחק הכוח בין מפלגות ואישים
images/000296.jpg,קלע בול,פגע במטרה בדיוק,הצליח לפגוע בנקודה המרכזית
images/000297.jpg,צו חיסול,הוראה להרוג,פקודה רשמית לחסל מישהו
images/000298.jpg,גילוי עריות,יחסים אסורים במשפחה,קשר מיני בין קרובי משפחה
images/000299.jpg,לוחם בשריון,חייל ביחידת טנקים,איש צבא שנלחם בתוך כלי רכב משוריין
images/000300.jpg,שיבולת בשדה,צמח דגן בשטח חקלאי,גבעול חיטה מתנועע ברוח