תמונה,פתרון,רמז קל,רמז קשה
images/000001.png,כיסא נח,רהיט שמתקפל ומשמש למנוחה,שמו כשם האיש שבנה תיבה
images/000002.jpg,עף על עצמו,ביטוי למישהו שחושב שהוא מאוד מוצלח,כמו ציפור אבל בגובה האגו
images/000003.jpg,מגן בגופו,משתמש בעצמו כמחסה להגנה על אחרים,אביר ללא שריון
images/000004.jpg,שרברביט,כלי עבודה של אינסטלטור + מקל קסמים,מילת הלחם של תיקון צנרת וקסם
images/000005.jpg,שוקולד ציפס,ממתק אפייה בצורת טיפות קטנות,מתיקות מפוצלת לחתיכות זעירות
images/000006.jpg,קולות החיילים,צלילים שמשמיעים אנשי צבא,הד של מגפיים צועדות בקצב אחיד
images/000007.jpg,חדשות,מידע עדכני על אירועים שונים,מה שקורה עכשיו בשמונה
images/000008.jpg,הטיח בפניו,אמר דברים קשים ישירות לאדם אחר,כמו לזרוק מילים כאילו היו חומר בנייה
images/000009.jpg,בית במושב,מגורים באזור כפרי,מבנה מגורים במקום שבין עיר לקיבוץ
images/000010.jpg,נוער בסיכון,צעירים הנמצאים במצב של סכנה או קושי,דור העתיד על קו התפר
images/000011.jpg,ירח מלא,גרם שמיים בלילה במלוא גודלו,עיגול לבן מושלם בשמי הלילה
images/000012.jpg,צדיק נסתר,אדם טוב שאינו מפרסם את מעשיו,גיבור אנונימי של מעשים טובים
images/000013.jpg,מרק כתום,מאכל נוזלי בצבע של גזר או דלעת,נוזל חם בגוון שקיעה
images/000014.jpg,מכל הלב,ביטוי לכנות מוחלטת,מעומק המשאבה הרגשית
images/000015.jpg,פנס בעין,סימן כחול סביב העין לאחר מכה,אור לא רצוי במקום הראייה
images/000016.jpg,פרמדיק,איש צוות רפואה בשטח,מציל חיים נייד
images/000017.jpg,מפריח בועות,יוצר כדורים שקופים ומעופפים,אמן של חלומות שבירים
images/000018.jpg,מצילתיים,כלי נגינה מתכתי בצורת צלחות,מחיאות כפיים מתכתיות
images/000019.jpg,עקרת הבית,אישה שאחראית על ניהול משק הבית,שורש ביתי עם תפקיד מסורתי
images/000020.jpg,בלש פרטי,חוקר עצמאי של תעלומות,צייד סודות בשכר
images/000021.jpg,להטוט,תרגיל קסמים פשוט,אשליה בקצות האצבעות
images/000022.jpg,פרי אהבתם,תוצאה של קשר רומנטי,יבול רגשי
images/000023.jpg,תנשמתכנת,ציפור לילה + מקצוע בהייטק,ינשוף דיגיטלי
images/000024.jpg,קריש דם,התקשות של נוזל גוף אדום,פקק טבעי במערכת הובלת החמצן
images/000025.jpg,טעם של עוד,רצון להמשיך לאכול או לחוות,תחושה שהחוויה לא מיצתה את עצמה
images/000026.jpg,סטרוברי,תות בלעז,פרי אדום עם זרעים על הקליפה
images/000027.jpg,קשר אמיץ,חיבור חזק בין אנשים,עניבה רגשית שקשה להתיר
images/000028.jpg,פיטר פנס,דמות מסיפור ילדים + מקור אור,ילד נצחי מואר
images/000029.jpg,נערת גומי,בחורה גמישה במיוחד,אקרובטית אנושית
images/000030.jpg,צחוק מתגלגל,הומור שממשיך ומתפשט,קול שמחה בתנועה מעגלית
images/000031.jpg,סוריקרטה,חיה מדברית קטנה,שומר המדבר הזקוף
images/000032.jpg,קפיר ליים,משקה חמוץ + פרי הדר,תסיסה בטעם ירוק
images/000033.jpg,שבלוליין,רכיכה + אמן קרקס,לוליין איטי במיוחד
images/000034.jpg,נמרולוג,חיה מנומרת + מומחה למספרים,מתמטיקאי עם פסים
images/000035.jpg,גמלאי,אדם שפרש מעבודה,לוחם החופש של הגיל השלישי
images/000036.jpg,משק בית,ניהול כלכלת הבית,מיקרו-כלכלה ביתית
images/000037.jpg,כסף זר,מטבע ממדינה אחרת,עלים ירוקים מארץ רחוקה
images/000038.jpg,קליעה משלוש,זריקה מרחוק בכדורסל,ניצחון מעבר לקשת
images/000039.jpg,עור ברווז,מרקם עור מיוחד בגלל קור,בגד טבעי נגד מים
images/000040.jpg,שער היורו,ערך המטבע האירופאי,דלת כניסה לכלכלת אירופה
images/000041.jpg,החמצת שער,פספוס הזדמנות להבקיע בכדורגל,לא לפגוש את הרשת כשצריך
images/000042.jpg,שימפנזמר,קוף גדול + אמן שירה,אמן ג'ונגל ווקאלי
images/000043.jpg,חזירקדנית,חיה מחוות + אמנית במה,רקדנית בוץ מקצועית
images/000044.jpg,הטביע את חותמו,השאיר רושם משמעותי,חתימה בלתי מחיקה על דף ההיסטוריה
images/000045.jpg,עומדת בשלה,לא משתנה למרות לחץ,נטועה באדמת הדעות שלה
images/000046.jpg,בית עץ,מבנה הבנוי על עץ,דירה בקומה העליונה של הטבע
images/000047.jpg,ערבי נחל,עץ הגדל ליד מים,שומר הנחל הירוק
images/000048.jpg,תמנונופש,בעל חיים ימי + חופשה,חופשה עם שמונה זרועות
images/000049.jpg,היפוכונדר,אדם הדואג יתר על המידה לבריאותו,"לקוח קבוע של ד""ר גוגל"
images/000050.jpg,חולצה לבנה,בגד עליון בצבע שלג,דף נקי ללבוש
images/000051.jpg,כרית אוויר,אמצעי בטיחות ברכב,שומר ראש מתנפח
images/000052.jpg,למונצלו,משקה אלכוהולי בטעם לימון,שתייה חמוצה-מתוקה עם בעיטה
images/000053.jpg,אחוז חסימה,סף מינימום לכניסה לכנסת,מחסום מספרי לפוליטיקה
images/000054.jpg,לחם כפרי,מאפה מסורתי,יצירה אפויה של הטבע
images/000055.jpg,טורף את הקלפים,מערבב את הקלפים בחוזקה,מחולל כאוס בסדר המשחק
images/000056.jpg,מאור פנים,הבעת פנים נעימה וחיובית,שמש פנימית המאירה החוצה
images/000057.jpg,מה קשור,ביטוי לחוסר רלוונטיות,גשר חסר בין רעיונות
images/000058.jpg,נפל דבר,קרה משהו משמעותי,אירוע כבד משקל נחת במציאות
images/000059.jpg,אגסוכן חשאי,פרי + איש מודיעין,ריגול בצורת טיפה
images/000060.jpg,בצק פילו,בצק דק מאוד לאפייה,שכבות דקיקות של גמישות קמחית
images/000061.jpg,קשרי פנים,קשרים בתוך הארגון,רשת חברתית פנים-חברתית
images/000062.jpg,מעבד מזון,מכשיר מטבח חשמלי,קוסם קולינרי אלקטרוני
images/000063.jpg,למון גראס,צמח תבלין בריח לימוני,לימון בצורת דשא
images/000064.jpg,לע הארי,חלק בפה של מלך החיות,לשון המלך
images/000065.jpg,חלב מרוכז,מוצר חלב סמיך וממותק,נוזל לבן שעבר דיאטה
images/000066.jpg,עלה על העצבים,הרגיז מאוד,טיפס על מערכת ההולכה הרגשית
images/000067.jpg,צמודה למדד,משתנה בהתאם למצב הכלכלי,רוקדת לפי קצב האינפלציה
images/000068.jpg,מי שברך,תפילה לרפואה או הצלחה,מרשם רוחני
images/000069.jpg,קרוקודילר,זוחל גדול + סוכן מכירות,טורף עם חיוך של איש מכירות
images/000070.jpg,יונה בחגווי הסלע,ציפור מסתתרת בסדקי אבן,שליח שלום בין הסלעים
images/000071.jpg,עז כנמר,חזק ואמיץ מאוד,אומץ מפוספס
images/000072.jpg,נשא בהשלכות,קיבל על עצמו את התוצאות,סחב את המזוודה של המעשים
images/000073.jpg,קיפודקאסט,יונק קוצני + תוכנית אודיו,שידור קוצני לאוזניים
images/000074.jpg,פרי בטנה,תינוק,יבול אנושי
images/000075.jpg,כסף נזיל,ממון זמין לשימוש מיידי,מטבעות בצורת מים
images/000076.jpg,רדיופוני,קשור לשידורי רדיו,צליל מהאוויר
images/000077.jpg,פיו וליבו שווים,אומר את מה שהוא באמת מרגיש,סנכרון בין הדיבור לרגש
images/000078.jpg,קוראת בכף היד,מנחשת עתידות לפי קווי כף היד,מפענחת מפת הגורל האישית
images/000079.jpg,חיית במה,שחקן או זמר מוכשר מאוד,יצור שניזון מאור הזרקורים
images/000080.jpg,אניית מעפילים,ספינה שהביאה עולים לא חוקיים לישראל,כלי שיט של תקווה אסורה
images/000081.jpg,נמלטשת יהלומים,חרק + מקצוע בתעשיית התכשיטים,מלכת היופי הזעירה של האבנים היקרות
images/000082.jpg,מעצב אופנה,יוצר בגדים ואביזרים,אמן של בדים ותפרים
images/000083.jpg,חרדונשיא,זוחל + מנהיג מדינה,מנהיג קר דם עם קוצים
images/000084.jpg,קרב רב,מאבק בין הרבה משתתפים,מלחמה של המונים
images/000085.jpg,אבד עליו הכלח,הפך למיושן או לא רלוונטי,עלה נובל של הרלוונטיות
images/000086.jpg,הקלה בעומס החום,ירידה בטמפרטורה הגבוהה,מזגן טבעי לקיץ הלוהט
images/000087.jpg,אצבע קלה על ההדק,נטייה לפעול במהירות ובפזיזות,יד מהירה בשדה הפעולה
images/000088.jpg,הפרת הבטחה,אי קיום של התחייבות,שבירת מילה שניתנה
images/000089.jpg,משך אותו בלשונו,התגרה בו או לעג לו,דיג מילולי של תגובה
images/000090.jpg,הצביע ברגליים,הביע דעה או העדפה דרך מעשים,בחירות עם הסוליות
images/000091.jpg,טניס שולחן,משחק ספורט עם מחבט קטן וכדור,פינג פונג בעברית
images/000092.jpg,פנים חתומות,הבעת פנים ללא רגש,מסכה אנושית של אבן
images/000093.jpg,פיתה עיראקית,לחם שטוח ממטבח המזרח התיכון,כיס קמח ממסופוטמיה
images/000094.jpg,כדור מים,ענף ספורט המשלב שחייה וכדור,כדורגל בבריכה
images/000095.jpg,גיהוץ כרטיס אשראי,שימוש מוגזם בכרטיס אשראי,החלקת פלסטיק עד לחום גבוה
images/000096.jpg,היפה בנשים,הנערה היפה ביותר,מלכת היופי הלא מוכתרת
images/000097.jpg,חתול במגפיים,דמות מסיפור ילדים,פרוותי עם נעליים
images/000098.jpg,מוצר מדף,פריט זמין לקנייה בחנות,סחורה מוכנה לצריכה
images/000099.jpg,גרושים,זוג שנפרד באופן חוקי,נשואים לשעבר
images/000100.jpg,עומד על הפרק,נושא שנידון כעת,סוגיה על סדר היום
images/000101.jpg,אישימוטו,כלי תחבורה דו-גלגלי יפני,אופנוע בשפה המשלבת עברית ויפנית
images/000102.jpg,סיכול ממוקד,פעולה צבאית מדויקת,חיסול מטרה ספציפית בדיוק כירורגי
images/000103.jpg,עב בשר,תיאור לאדם שמן,בעל נפח גופני מוגזם
images/000104.jpg,איפון,מכשיר סלולרי פופולרי,טלפון חכם עם לוגו של פרי נגוס
images/000105.jpg,עזרת נשים,אזור בבית כנסת,מרחב תפילה נפרד לנשים
images/000106.jpg,קארפול,נסיעה משותפת ברכב,שיתוף נסיעות להפחתת עומס בכבישים
images/000107.jpg,מרוץ שליחים,תחרות ריצה קבוצתית,מעביר את המקל מרץ לרץ
images/000108.jpg,שיא גינס,הישג יוצא דופן,רישום בספר העולמי של הישגים מרשימים
images/000109.jpg,אנטיפסטי,מנה איטלקית של ירקות,פתיחה טעימה לארוחה מדרום אירופה
images/000110.jpg,טיפוס מורכב,אישיות מסובכת,אדם עם אופי רב-ממדי ולא פשוט להבנה
images/000111.jpg,מצביע בקלפי,משתתף בבחירות דמוקרטיות,מממש את זכותו האזרחית בתא פרטי
images/000112.jpg,משפחה גרעינית,יחידה משפחתית בסיסית,הורים וילדיהם ללא קרובים נוספים
images/000113.jpg,ריצה קלה,פעילות ספורטיבית מתונה,ג'וגינג בקצב נוח
images/000114.jpg,עץ ירוק מפלסטיק,קישוט מלאכותי,צמח נצחי שאינו דורש השקיה
images/000115.jpg,מתקפת דידוס,סוג של פשע מקוון,הצפת שרת במטרה להפיל אותו
images/000116.jpg,צילום עצמי,תמונה שאדם מצלם של עצמו,סלפי בעברית תקנית
images/000117.jpg,הקש ששבר את גב הגמל,הדבר האחרון שגרם לקריסה,טיפה אחרונה שגרמה לגלישת הכוס
images/000118.jpg,נר לרגליו,מקור השראה והכוונה,אור מנחה בדרך החיים
images/000119.jpg,ספר מחזור,אלבום זיכרונות מבית הספר,תיעוד מודפס של שנות הלימודים
images/000120.jpg,ניבל את פיו,דיבר בצורה גסה,זיהם את שפתיו במילים לא ראויות
images/000121.jpg,רובין הוד,גיבור עממי אנגלי,גנב מהעשירים ונתן לעניים
images/000122.jpg,מגדלור,מבנה המכוון ספינות בים,מגדל מאיר דרך לשייטים
images/000123.jpg,קווים לדמותו,תיאור של אופי אדם,שרטוט מילולי של אישיות
images/000124.jpg,דג סול,מאכל ים שטוח,דג בעל שם של נעל באנגלית
images/000125.jpg,הענק וגנו,סיפור ילדים מפורסם,אגדה על חברות בין שונים בגודלם
images/000126.jpg,אסקופה הנדרסת,דבר שדורכים עליו בכניסה,מפתן הדלת שכולם משפילים
images/000127.jpg,סגר מעגל,השלים תהליך,חזר לנקודת ההתחלה אחרי מסע
images/000128.jpg,תפס צבע,השתזף,קיבל גוון כהה יותר בעור
images/000129.jpg,השבר הסורי אפריקאי,תופעה גיאולוגית,קו שבר גדול בקרום כדור הארץ
images/000130.jpg,תוהה על קנקנה,מנסה להבין את מהותו האמיתית,בוחן את המהות מעבר למראה החיצוני
images/000131.jpg,שעון בן חיל,אביזר יקר לגבר,שעונים איכותיים וגבריים
images/000132.jpg,סורינם,מדינה בדרום אמריקה,ארץ קטנה עם עבר הולנדי ביבשת הדרומית
images/000133.jpg,מעשן בשרשרת,מכור לסיגריות,מדליק סיגריה אחת מהשנייה
images/000134.jpg,מרבדים,שטיחים גדולים,משטחי בד על הרצפה
images/000135.jpg,בחור זהב,אדם טוב מאוד,נער עם לב של מתכת יקרה
images/000136.jpg,מקושקש,מבולבל או לא מסודר,נראה כמו ציור של ילד קטן
images/000137.jpg,למד על בשרו,חווה משהו באופן אישי וכואב,שיעור שנלמד דרך סבל אישי
images/000138.jpg,חנוך לנער על פי דרכו,עצה לחינוך ילדים,פתגם מספר משלי על הדרכת הדור הצעיר
images/000139.jpg,שרלטן,רמאי או מתחזה,אדם המציג עצמו כמומחה ללא הכישורים המתאימים
images/000140.jpg,צילום אווירי,תמונה שצולמה מלמעלה,תצלום שנעשה ממטוס או רחפן
images/000141.jpg,גרש בגט,סימן דקדוקי צרפתי,תו ניקוד בצורת כיכר לחם
images/000142.jpg,מנגינת החליל,צליל כלי נשיפה,מוזיקה הבוקעת מצינור עץ עם חורים
images/000143.jpg,גליליאו גליליי,מדען איטלקי מפורסם,אבי המדע המודרני שגילה שכדור הארץ נע
images/000144.jpg,נייר ממוחזר,מוצר ידידותי לסביבה,דף שנוצר מפסולת נייר
images/000145.jpg,יער עבות,שטח צפוף של עצים,ג'ונגל של צמחייה סבוכה
images/000146.jpg,קרטון ממוחזר,אריזה ירוקה,חומר אריזה שנוצר מפסולת נייר
images/000147.jpg,שוחה נגד הזרם,פועל בניגוד למקובל,תנועה הפוכה לכיוון הנהר
images/000148.jpg,דגים מעושנים,מאכל ים מעובד,בשר ים שעבר תהליך שימור באש
images/000149.jpg,מגבעת חרדים,כובע המזוהה עם קבוצה דתית,כיסוי ראש שחור של גברים אורתודוקסים
images/000150.jpg,טסלה,חברת רכב חשמלי,מכונית על שם ממציא זרם החשמל
images/000151.jpg,צריכת חשמל,שימוש באנרגיה ביתית,מונה שמסתובב כשהאור דולק
images/000152.jpg,גליל מערבי,אזור בצפון הארץ,חבל ארץ הררי עם נוף לים התיכון
images/000153.jpg,קופה רושמת,מכשיר לתיעוד מכירות,מחשבון עם מגירת כסף
images/000154.jpg,טיל על חוטים,צעצוע מעופף מסורתי,רקטה שנשלטת מהקרקע
images/000155.jpg,צינורות מקובלים,דרכי תקשורת מוכרות,ערוצים מאושרים להעברת מידע
images/000156.jpg,סנדלי שורש,נעליים טבעיות,הנעלה שצמחה מהאדמה
images/000157.jpg,השומר הצעיר,תנועת נוער ציונית,ארגון חלוצי לבני נעורים
images/000158.jpg,צילום סיטי,תמונה של עיר גדולה,פורטרט אורבני
images/000159.jpg,בשום פנים ואופן,ביטוי להתנגדות מוחלטת,סירוב מוחלט בכל צורה שהיא
images/000160.jpg,גמד גינה,קישוט נפוץ לחצר,פסל קטן וצבעוני שעוזר בגינון
images/000161.jpg,מעצבת פנים,מקצוע בתחום העיצוב,אדריכלית של החלל הביתי
images/000162.jpg,ארטיקים,ממתקים קפואים על מקל,קרטיבים בלעז
images/000163.jpg,אנטיפת,מנה ראשונה באיטלקית,פתיחה טעימה לארוחה
images/000164.jpg,סתימת פיות,מניעת ביטוי,השתקה של דעות לא רצויות
images/000165.jpg,בני ערובה,אנשים המוחזקים בכפייה,קלפי מיקוח אנושיים
images/000166.jpg,שיח משותף,דיאלוג בין צדדים,צמח של תקשורת
images/000167.jpg,רץ ברשת,מידע שמתפשט במהירות באינטרנט,וירוס וויראלי
images/000168.jpg,מיקרופון,מכשיר להגברת קול,אוזן אלקטרונית למילים
images/000169.jpg,הגעלת כלים,תהליך הכשרה למטבח,טבילה חמה לניקוי רוחני
images/000170.jpg,ביקורת בונה,הערות לשיפור,משוב חיובי עם כיוון לעתיד
images/000171.jpg,כלים שלובים,מערכת הידראולית בסיסית,עקרון פיזיקלי של נוזלים מחוברים
images/000172.jpg,אסתר המלכה,דמות מקראית,גיבורה יהודייה שהצילה את עמה
images/000173.jpg,משפחה,קבוצה של קרובי דם,יחידה חברתית בסיסית
images/000174.jpg,בחור חטוב,גבר בעל גוף מעוצב,אדוניס אנושי
images/000175.jpg,משפחת המצליבים,קבוצת צמחים,פרחים בעלי ארבעה עלי כותרת
images/000176.jpg,מרקש,עיר במרוקו,פנינה אדומה במדבר
images/000177.jpg,יום עמוס,24 שעות מלאות פעילות,מרתון של משימות
images/000178.jpg,עגלת תינוק,כלי תחבורה לפעוטות,מרכבה לנסיך או נסיכה קטנים
images/000179.jpg,צחוק בצד,להיות רציני,לשים את ההומור על המדף
images/000180.jpg,מדע מדויק,תחום ידע עם כללים ברורים,פיזיקה היא דוגמה לזה
images/000181.jpg,ערפילים,תופעת מזג אוויר,מסך לבן בשמיים
images/000182.jpg,לומדת לחנות,מתאמנת בקניות,שיעור מעשי בצרכנות
images/000183.jpg,צבועים,חיות טורפות או אנשים צבועים,יונקים מפוספסים או בני אדם לא כנים
images/000184.jpg,הנץ החמה,זריחת השמש,הופעת האור הראשונה בבוקר
images/000185.jpg,אזרח ותיק,כינוי מכובד לאדם מבוגר,פנסיונר בלשון המכבסה
images/000186.jpg,בין המצרים,תקופה בלוח העברי,שלושה שבועות של אבל
images/000187.jpg,משפחה מורחבת,קרובי משפחה מעבר לגרעין,שבט משפחתי גדול
images/000188.jpg,שיחת חולין,דיבור על נושאים יומיומיים,פטפוט שאינו על קודש
images/000189.jpg,עגלת מתקפלת,כלי לנשיאת תינוק שניתן לקפל,מרכבת תינוקות ניידת
images/000190.jpg,הגנת הצרכן,חוקים להגנה על קונים,מגן משפטי מפני עסקים לא הוגנים
images/000191.jpg,כולל הכל,שירות או מוצר מקיף,חבילה שלא משאירה כלום בחוץ
images/000192.jpg,עדי ראיה,אנשים שראו אירוע,צופים בהתרחשות אמיתית
images/000193.jpg,עגלת קפה,דוכן נייד למכירת משקאות חמים,בית קפה על גלגלים
images/000194.jpg,משפחת מלוכה,קבוצת השליטים בממלכה,שושלת של כתר ושרביט
images/000195.jpg,בונת ציפורנים,מטפלת ביופי של הידיים,אמנית של לק וג'ל
images/000196.jpg,פריסה ארצית,כיסוי של כל הארץ,שירות שמגיע לכל פינה במדינה
images/000197.jpg,מדיח כלים,מכשיר חשמלי לניקוי כלי אוכל,רובוט ביתי לשטיפת צלחות
images/000198.jpg,עגלה עם סוסה,כלי תחבורה מסורתי,מרכבה עם כוח סוס אמיתי
images/000199.jpg,מזון מהיר,אוכל שמוכן במהירות,ארוחה מהירה יותר מבישול ביתי
images/000200.jpg,על גג העולם,ביטוי להצלחה גדולה,תחושה של להיות במקום הכי גבוה
images/000201.jpg,משולשים חופפים,צורות גיאומטריות זהות,זוג גיאומטרי שכל הצלעות והזוויות שלו שוות
images/000202.jpg,מהרהר,חושב עמוקות,מתעמק במחשבות פילוסופיות
images/000203.jpg,גזירות משמים,החלטות אלוהיות,פסקי דין שמקורם מעבר להבנה האנושית
images/000204.jpg,דיור מוגן,מגורים לגיל השלישי,בית לעצמאים שזקוקים לקצת עזרה
images/000205.jpg,מוחמד דף,מנהיג פלסטיני,ראש ארגון טרור בעזה
images/000206.jpg,מרעיפה אהבה,נותנת חיבה בשפע,מקלחת של רגשות חמים
images/000207.jpg,תפסת מרובה לא תפסת,ביטוי לחמדנות מוגזמת,פתגם על הסכנה שברדיפה אחר יותר מדי
images/000208.jpg,סוכריה חמוצה,ממתק עם טעם חריף,מתיקות עם עקיצה בלשון
images/000209.jpg,מפלס הכנרת,גובה המים באגם הלאומי,מדד לכמות המים במאגר הטבעי של ישראל
images/000210.jpg,דון קישוט,גיבור ספרותי ספרדי,אביר שנלחם בטחנות רוח
images/000211.jpg,יצא לחפש אתונות ומצא מלוכה,ביטוי למציאת דבר גדול בחיפוש אחר דבר קטן,סיפורו של שאול המלך בתנ"ך
images/000212.jpg,שליח ציבור,נציג הקהל בתפילה,החזן שמוביל את התפילה בבית הכנסת
images/000213.jpg,דנקשן,מאפה מתוק אמריקאי,סופגנייה בצורת טבעת
images/000214.jpg,סחוט טבעי,מיץ פירות ללא תוספות,משקה שנסחט ישירות מהפרי
images/000215.jpg,על מה ולמה,ביטוי לשאלה על סיבה,חקירה על המניעים והסיבות
images/000216.jpg,הכשת נחש,פגיעה מזוחל ארסי,עקיצה מסוכנת מבעל חיים מתפתל
images/000217.jpg,איש תחת גפנו ותחת תאנתו,ביטוי לשלום ושלווה,חזון נבואי של חיים בביטחון ורווחה
images/000218.jpg,פיתון,נחש גדול,זוחל ענק שחונק את טרפו
images/000219.jpg,סרטים מצויירים,סוג של אנימציה,קולנוע שמצויר ביד
